ID,Textos,Título
89,"                                           Depois do silêncio                                                                      Guilherme Pinheiro Pozzer         Há exatos dois anos, António fora o último a passar pelo portão da fábrica. Os dias que  antecederam aquele momento foram de pensamentos quanto ao futuro incerto. Ele ainda tem  razões para perguntar quem há de contratar um sujeito de 53 anos e que só trabalhou ali?         Desde que fora para o desemprego, toma remédio para o coração. Um médico mandara  lhe fazer yoga, para relaxar um bocadinho. Não teve interesse e confessava a si mesmo ter  tido vontade de rir na cara do rapazito mais jovem que o filho, que vivia na capital.         Ainda estranhava almoçar em casa. Sempre levara sua marmita ao trabalho. Lembrou  dos pais, extrabalhadores da fábrica. Aposentaramse tendo tido um único emprego na vida.  Lembrou da mulher, que conhecera na cantina da empresa, numa quartafeira de um frio  novembro, há cerca de 30 anos. O filho nascera no hospital fundado pela fábrica, pouco mais  de um ano depois de a mulher, então apenas colega operária, virar café nas suas calças durante  o almoço e sorrir. Ela faleceu há três anos. Para pagar dívidas da fábrica, o hospital fora vendido  a uma empresa de saúde que António e a mulher não conseguiam pagar. As viagens à capital  eram cansativas. Ela tinha dores terríveis no fim. No dia seguinte à partida dela, António foi ao  trabalho mesmo tendo folga. Era melhor do que ficar na casa fria e só.         Hoje, António estava na casa fria. Sozinho e em silêncio. Ao fim da manhã, decidiu ir à  fábrica. Levou consigo a antiga marmita e uma pequena garrafa com café. Estava abandonada  e vandalizada. Havia mato onde antes havia jardins, buracos nos telhados, portas no chão,  janelas com vidros quebrados. Mas António ainda reconhecia cada corredor. Cada percurso que  fez por 30 anos. Da tecelagem à fiação, por um corredor subterrâneo, escuro e úmido. Dali às  engomadeiras, à estamparia mecânica por uma escada e por outra à tinturaria.         Por um longo corredor, agora sem qualquer iluminação, viu ao longe a luz do sol por  uma porta que levava ao centro da fábrica. Caminhou devagar, tropeçando em garrafas e latas.  Chegou à porta e ali, enquanto seus olhos se readaptavam à claridade, viu aquilo que mais o  encantou desde que fora, ainda pequenino, com seu pai à fábrica: a chaminé. Seus tijolos  avermelhados, empilhados a uns 40 metros de altura, ainda não tinham desbotado. Não havia a  fumaça nem o barulho assustador que o fizera abraçar as pernas do pai. Seus olhos encheram  se de lágrimas. Foi o sol, tentou convencer a si mesmo.         Foi à cantina. Limpou uma cadeira que lá estava, mas não havia mesa. Almoçou o seu  sanduíche de queijo. Tomou café. Não ouviu nada além do rio que um dia teve turbinas para  movimentar. Suspirou, foi para casa e continuou a recordar.         Sentiu que descobrira o que vem depois do silêncio.   ",depois do silencio
90,"                                      Almas em ruínas                                                                   Guilherme Pinheiro Pozzer         Supostamente, o edifício da Tecelagem ‘B’ já não tinha uso, deveria estar vazio,  abandonado, em ruínas. Mas alguém esteve ali há pouco. Tão logo passei a porta, cuja ressecada  tinta azul descama lentamente, vi uma pequena sala improvisada: um sofá elevado sobre dois  caixotes de tecidos em frente a dois bancos paralelos. Ao lado, uma pequena mesa e um caixote  que faz as vezes de cadeira. Que tipo de evento se realizaria ali? Uma peça de teatro? Uma  roda de amigos? Seria o sofá um trono? Uma sala de audiências? Quem são as pessoas que  usam aquele espaço?         Nas paredes monumentais do pavilhão não faltavam grafites. Ao fundo, atrás do trono,  pouco acima da altura dos meus olhos, um pequeno símbolo anarquista (        ) contrasta com a  disposição meticulosa dos móveis. De súbito tenho a sensação de estar em um ambiente  hierarquizado que evoca autoridade e poder. Um sopro do antigo espaço controlado da fábrica  têxtil (uma das pioneiras da região, projetada como completa).         Livrome da sensação ao ler liberdadeem uma parede lateral e passo a ver o  mobiliário, na forma como foi disposto, como uma tentativa de valorizar e sugerir um recomeço  ao espaço degradado, vazio e, de certa maneira, esquecido e invisível.           Observo que, ao lado do símbolo anarquista, há um pequeno OM (          ). De origem  hindu, ele representa o que é eterno, atemporal e imutável. O símbolo daquilo que transcende o  tempo contrasta com a ruína, uma metáfora material do tempo. E é impossível resistir à  experiência de pronunciar o OM em voz alta no pavilhão e ouvir um eco da eternidade entre  as paredes do que é efêmero. Naquele local, onde as máquinas silenciaram há muito, esta  pequena palavra preenche brevemente o vazio.         No fundo do edifício, em tinta negra, uma monumental figura masculina com longos  cabelos e barba. A luz natural de um buraco no telhado atinge apenas um lado do grafite. Ali,  os cabelos estão calmos, mas a sobrancelha está tensa. No outro lado, escurecido pela sombra,  a sobrancelha sugere tranquilidade, mas os cabelos estão esvoaçantes e agitados enquanto, pelo  seu rosto, escorrem lágrimas de chuva se infiltram no edifício. O que diz esta dualidade? O que  ele sente? O que eu sinto?         Na volta à entrada, um último e pequeno grafite, Live after death. Perguntome, já  com chuva no rosto: haverá vida depois da morte para a fábrica Sampaio, Ferreira?         Suspiro e esboço um sorriso ao pensar: se os tijolos e o aço daquelas ruínas forem o  corpo do espaço, não seriam as pessoas, ainda que silenciosas e invisíveis, as almas do lugar?   ",almas em ruinas
91,"                        LA FÁBRICA DE LOZA    El anciano, como cada mañana se dirige hacia su antiguo puesto de trabajo, saluda  al imaginario jefe de estación y se sube al puente de hierro para observar su  derruida fábrica de loza. El tiempo parece detenerse.    La niña, viendo alejarse la silueta de su abuelo cada mañana, le pregunta a su madre  el porqué de ese itinerario repetitivo. La madre, con los ojos vidriosos, intenta  explicar de manera comprensible a su hija que la mente de su abuelo se desvanece.    La cabeza del abuelo se deteriora como el edificio que observa cada mañana . Esa  fábrica lo fue todo para él, ya desde muy temprana edad conoció el oficio, el mismo  que habían desempeñado sus padres. Más tarde, conoció allí mismo siendo muy  jóvenes a tu abuela, la que fue el amor de su vida, de la que nunca se separó hasta  que murió hace unos años. Todo su mundo está encerrado entre esas paredes, o lo  que queda de ellas...    Imagina que su cabeza es como la fábrica, Ves aquella chimenea tan hermosa,  que parece que se va a desplomar? Pues así está el cerebro del abuelo, sujeto entre  los nobles ladrillos y el cemento, pero a punto de derrumbarse.    Te acuerdas el día que entramos a escondidas en el interior de la fábrica? Pues  sus neuronas, eso que une la información de nuestro pensamiento, están como  aquellos platos que vimos desperdigados por toda la fábrica, hechos añicos y  esparcidos por el suelo. Aquellos moldes que antaño alguien previsor guardó para  que no se estropearan, hoy yacen tirados por toda la estancia sin que haya  pegamento que pueda unirlo.    En todos estos años, solo mejoró con aquellas pastillas famosas llamadas BIC, pero  que solo fueron una pequeña ilusión de la gente que lo queríamos, al tercer año de  su ingesta tu abuelo volvió a recaer, y el deterioro siguió su curso.    Al igual que a la fábrica, a tu abuelo no le queda mucho tiempo, tan solo esperar  que la muerte lo acaricie silenciosamente, ver como se desmorona su patrimonio  mental, hasta que solo quede lo intangible de sus anécdotas y la impronta de un  recuerdo que nos haga valorar el sentido de la vida.    Luis Parra   ",la fabrica de loza
92,"                                               De tablas y aulas                              Las risas, las caras de sorpresa y el jolgorio de niños y                              niñas inundaban la sala. Ventanas tapadas con viejos                              tableros. Oscuridad intencionada. Un silencio sepulcral                              precedía a la luz que brotaba de aquella máquina nacida                              de un montón de tablas. Decía el maestro que eran                              chispas de ciencia, aunque a mí me parecía magia.      La hoja de la libreta rezaba electrostática. Lo acompañaba un dibujo, un dictado y  una fecha que hoy clama. Era junio de 1936 y en ciernes, la llama.                                             Hemos vuelto a la escuela, pero nada está como estaba. Han cambiado la bandera y  el himno. Han desaparecido las tablas. Unos dicen que el maestro escapó. Otros, que  en paz descansa. No se le puede nombrar. Sus libros y su máquina alimentan el fuego  de la sala.                                             Hoy soy yo el maestro. Hoy presido yo la sala. Les hablo de estrellas y mirlos, de  átomos y galaxias. Yo sí uso sus libros. Los consulto solo en casa. Arranqué su  nombre de la portada, pero nunca olvidé sus enseñanzas. Hoy soy yo el maestro y he  construido su máquina. Han vuelto la risa y la sorpresa, indispensables en toda  enseñanza.                                             Han cambiado los tiempos. Han cambiado las aulas. Se ha olvidado a aquellos  maestros que su vida regalaron a la enseñanza. Se han perdido sus artefactos, sus  construcciones y sus máquinas, pero han perdurado sus dibujos, que hoy nos hablan  de sus aulas. De unas aulas llenas de ciencia, de juventud y de esperanza. Anhelos  compartidos por los que amamos la enseñanza.      Qué fue de los tableros? Qué fue de aquellas máquinas? Murieron por el polvo y el  tiempo o ejecutadas por las llamas. Hoy perdura su rastro escondido entre  amarillentas páginas. Máquinas que dejaron huella en vidas ya enterradas. Máquinas  que siguen intactas, entre figuras y palabras. Son las máquinas de los maestros, que  seguir educando aguardan.   ",de tablas y aulas
93,"El Ingenio      Era ruidoso. Ni los aceites y ungüentos de alto precio, ni las sustancias  amortiguadoras traídas de tierras lejanas, le habían permitido reducir el estruendo  que bañaba la ladera de la ciudad cuando el inmenso artificio se animaba. Gastó  horas incontables puliendo y lubrificando ruedas y tirantes, brazos, tubos y poleas,  pero inútilmente. El sonido permanecía intenso y desagradable. Y, una vez más, el  ingeniero emprendedor recibió la visita de los representantes ciudadanos.  Contaminación acústica era el término de moda, repetido incesantemente por  concejales, periodistas y vecinos. Y frente a tal unanimidad de poco valían las  apelaciones a sacrificarse por el progreso. Comprendió el ingeniero que ya no habría  más visitas, que la paciencia de los oyentes se había agotado y que las elecciones  municipales estaban cerca. Todos los candidatos habían jurado que su primera  medida sería ordenar el desguace de aquella cadena de armatostes, como  denominaban a su máquina maravillosa. A modo de consuelo hubo quien sugirió al  arruinado emprendedor que en el futuro mostrase los inmóviles mecanismos a los  turistas, cobrándoles la entrada. De algo serviría la fama ganada por el artificio entre  aquellos que no padecían su estrépito, explicó.        Aquella última tarde llegaron los alguaciles con el escrito del juez, ordenando  detener las máquinas. Y así hizo su creador, que despidió a los operarios pero  quedándose él en las instalaciones, para recoger la documentación, dijo.  Poco después de la medianoche los vecinos oyeron, primero asombrados y luego  enfurecidos, que el artificio había despertado de nuevo. Y su rugido no sólo subía en  volumen sino también en la viveza de su ritmo, como si los mecanismos  interpretasen un allegro tempestuoso de ferocidad creciente. Pronto se llenaron las  calles de ciudadanos equipados con objetos contundentes, armamento inútil pues no  fueron capaces de entrar en el reptante edificio para detener la maquinaria  desquiciada. Pero ni puertas, muros o tejados resistieron el estallido de la cadena de  artefactos cuyo movimiento enloquecido había ya superado todos sus límites de  resistencia. Los fragmentos volaron acompañados de gases ardientes y en pocos  minutos los incendios se extendieron incontrolables por los barrios cercanos.        Nunca se encontró el cuerpo del ingeniero emprendedor, pero hay quien  afirma que enseña mecánica en una oscura universidad americana.   ",el ingenio
94,"La coleccionista      La inauguración de la nueva sala del Museo de la Ciencia y la Técnica no resultó tan  tediosa como Carmen había anticipado, a pesar de los obligados saludos, discursos  y agradecimientos. Porque, para sorpresa de la dama patrocinadora, el recién  desvelado contenido era fascinante. Cuando un año antes accedió a donar una  notable cantidad para el montaje del Salón de Robótica, lo hizo por la insistencia de  Andrés, reciente y cuarto marido. Y se olvidó del asunto hasta ese día inaugural.  Pero no descubrió una aburrida muestra de robots industriales o quirúrgicos, sino  una colección de androides extraídos de la ficción. Alojados en oscuros nichos  abiertos en el perímetro de la sala, María, Robby, C3PO, R2D2, Robocop, Alita y  otros muchos que Carmen no supo reconocer, devolvían miradas y gestos a los  espectadores. Pues estaban dotados de movimiento, leve pero suficiente para darles  apariencia de vida. Pero lo que más conmovió a la mujer fue descubrir que no eran  muñecos de plástico y metal, sino hologramas casi perfectos. Y asaltada por una  visión partió en busca del autor de aquellas esculturas de luz. El ingeniero artista la  saludó con curiosidad y prevención. La coleccionista de maridos, como la llamaban  algunos periodistas temerarios. Maridos muy ricos que fallecían prematuramente.  Carmen quería saber si era posible reproducir figuras humanas. Por supuesto, si hay  suficiente documentación gráfica. La había. Debía ponerse a ello inmediatamente. El  coste no era problema. Mis tres maridos difuntos, claro, contestó a la cuestión  planteada por el ingeniero. Hay infinitas fotos y películas disponibles, añadió la  dama, preguntando si se podría hablar con ellos. No hace falta que lo hagan muy  bien, basta con que asientan a lo que yo diga, aclaró. Despachado el atónito pero ya  comprometido experto, Carmen se alejó de los demás invitados para repasar  tranquila los detalles de su nuevo proyecto, que otros hubieran llamado capricho o  extravagancia. Convenientemente reformado, el salón de baile del casón de Las  Rozas será muy adecuado para alojar a Felipe, Gonzalo y Henry, se dijo. Aunque tal  vez fuera demasiado grande para solo tres inquilinos. Seis sería un número perfecto,  concluyó. O al menos, cuatro. Unos metros más allá, Andrés captó su mirada y le  envió una sonrisa, apenas devuelta por Carmen. Suponía la mujer que las versiones  holográficas de los difuntos podrían incorporar mejoras sobre su estado pre mortem.  Por ejemplo, haciendo a Andrés un poco más alto. Y le observó pensativa.   ",la coleccionista
95,"                                     Ferroviario       Desde hacía ya tiempo, quería conocer el sitio donde mi abuelo había nacido y  crecido. De niño, mientras devoraba las natillas con galleta y canela, preparadas por  mi abuela, disfrutaba escuchando las historias contadas en persona, por mi abuelo:  las que me hacían viajar por países lejanos, conocer personajes sorprendentes y  vivir aventuras únicas.   Los años se fueron pasando, crecí, los vi envejecer e irse poco a poco hasta la  despedida sin retorno que nos impone la ley de la vida.   Conservo el tren eléctrico, hecho a escala, que me regaló ese madrileño tan  amado, el padre de mi padre. Hasta le he hecho una maqueta, siguiendo las  descripciones que él hacía de los paisajes y       su   gente,   para que recorra las  estaciones del barrio que dieron vida y acunaron las        aventuras de las que fue  protagonista en muchas, y testigo en otras tantas ocasiones.   Lo que no imaginé es que la vida me llevaría al sitio donde sus anécdotas tuvieron  lugar. Por viajes de mi trabajo, pude solicitar un certificado donde constaba la  dirección exacta donde había nacido él. Estaba registrado su bautizo en la Iglesia  San Roque, en Fuencarral, pueblo. En numerosas oportunidades recorrí el barrio  para localizar la calle que figuraba en el certificado de la iglesia, pero nunca logré  encontrarla. Muchos nombres de calles          habían cambiado y ese nombre en  particular, nadie lo conocía.   Por esas cosas de la vida, en la empresa donde trabajo, me destinaron a Madrid. El  mantenimiento de los ferrocarriles es mi profesión. Pasaron meses, hasta que, uno  de los requerimientos de la empresa era que inspeccionara yo los talleres del  ferrocarril en Fuencarral.   Escribí la dirección en el GPS, y llegué al destino sin dificultades. Entré con el auto  a los talleres, este moderno patrimonio de la industria, que no pertenece al pasado,  sino que a él, el pasado pertenece, por las calles internas, iluminadas con luz  artificial cargadas de historias que completan el éter.   Mi corazón casi se detuvo, al constatar en la pantalla del navegador, consternado y  atónito, que estaba yo justo sobre la calle en la que mi abuelo había nacido. Esa  que, resignado, tras incontables intentos fallidos, había desistido de seguir  buscando.   ",ferroviario
96,"                         LA TORRE CON LA QUE SOÑABA NICO.             Viajaban los pensamientos de Nico por la senda de un mundo futurista, guardado con  celo en su memoria fotográfica. Su mente, bisoña y visionaria, secuenciaba imágenes  misteriosas que edificaban una extraña torre, semejante a un gigantesco hongo Qué significaba  aquello que percibía? Ese día se acercó al parque y se sentó en un banco, en compañía de las  palomas que pululaban por allí. Nico frotó su brazo y vio cómo se erizaba el vello de su piel  bajo la influencia de la electricidad estática. Ensimismado, caminó por territorios oníricos, y su  clarividencia le guio hacia la torre. Despertó de su letargo cuando escuchó las increpaciones de  su padre: se había olvidado de ir a comer. La reprimenda fue severa, aunque él lo interpretó  como un rumor melifluo. Tenía la certeza de que aquella visión sellaría su destino.         Desde tal acontecer, Nico estudió con denuedo. Sus estanterías se llenaron de libros, los  anaqueles de su intelecto se colmaron de inventivas. Se rodeó de bombillas, de bobinas, de  cables; la electricidad y el electromagnetismo lo acompañaron por siempre. Pero pensaba en  su sueño de parvulario. Cuando los hilos conductores de la corriente alterna concedieron luz a  los hogares, se iluminó su ingenio creativo Había descifrado el sueño! Aquella torre, que  aparecía y reaparecía en su imaginación, se erigía como un enorme generador de energía  inalámbrica. Un invento que revolucionaría el mundo.         Gastó Nico sus neuronas, su ingenio, su dinero y el de socios inversores en construir su  gigantesco generador con el que produciría energía gratuita a la Humanidad, y que asoció al  bienestar y a la paz. Pero su filantropía se estrelló con la realidad de aquella primera mitad del  siglo XX, dominada por el poder del dinero y por la fuerza de las armas. Solo desencriptó su  sueño a medias, y el proyecto sucumbió en los abismos de una dolorosa derrota.         Al cabo de los años, Nico, anciano, arruinado y decepcionado, se sentó en un banco y  se rodeó de palomas. Sus remembranzas lo guiaron hacia el niño que soñaba con una torre de  energía inalámbrica. Y pensó que el destino eligió a la persona correcta, pero erró al seleccionar  la época. Quizás la sociedad no estaba preparada para su proyecto.         Recordó a aquel chaval al que se le olvidaba ir a comer, y permaneció embebido en esas  sensaciones. Y en esta ocasión, se le olvidó respirar.             La torre de ese genio llamado Nikola Tesla fue derruida en 1917. Su historia se sume en  el éxito indiscutible de sus inventos, en el fracaso estrepitoso de sus propósitos y en la polémica  constante por sus ideas, a veces incluso peregrinas. Más de un siglo después, el proyecto de la  torre Wardenclyffe dormita, en espera de que otra mente prodigiosa ose despertarlo.   ",la torre con la que sonaba nico
97,"LAS MÉDULAS    Me llamo Publio Rufo y fui manumitido por mi señor para trabajar en estas landas de la  Hispania Tarraconense, a las órdenes de Cayo Plinio Secundo, gran naturalista y pretor de  Roma. Soy capataz, gracias a la bondad e influencias de mi amo. A mis órdenes trabajan cien  antiguos esclavos, como yo, sin pausa; la enfermedad o la muerte son su único reposo.    Es esta la mina abierta más grande del Imperio y quizá de la historia de los hombres. Son tierras  de aluvión en pendiente, con polvo de oro y abundante agua para discernirlo y rescatarlo. Yo  mismo he mandado canalizar y embalsar riachuelos de montaña que ayuden a tal fin.    Es grande el apetito de los humanos por el oro. Se vive para conseguirlo, se mata para obtenerlo.  Se miden las civilizaciones por la posesión del mineral ansiado.    Al llegar a los depósitos esperan al agua unos taludes. Allí se separa lo estéril del metal con  cuencos de doble rejilla y piel de oveja. Al ver el fugaz centelleo se grita: Aureus, y se acercan  los vigilantes. Se pesa lo encontrado, y el obrero que lo halla come más cebollas y bebe más  cerveza. Si alguien tragara una pepita, y puede demostrarse, es degollado al punto y se le extrae  del cuerpo. Por eso ninguno acerca las manos a la boca durante el trabajo, para eliminar dudas.  Miles escogen laborar aquí, antes que entrar en el vientre del mundo, porque ven el sol, que es  la vida. En las grandes celebraciones se les ofrece vino, y hasta prostitutas sufragadas por el  cuestor para que sigan teniendo apego al existir.    En unas casas especiales se purifica el metal bajo una técnica aprendida de los antiguos  egipcios; se funde con plomo y salvado de cebada, da forma en artesas y se envía. Quienes esto  hacen comen bien y duermen más. Hoy mismo he preparado un cargamento a Roma, pues el  Emperador así lo ha decidido. Nunca se formulan preguntas, pues la respuesta puede ser el filo  de la espada.    Pido a los dioses no fallecer muy pronto, ya que me son gratos el sueño, la bebida y el respirar.  En el bastón de mando, como es costumbre, hay incrustado un pedazo mínimo de oro. Todos  los días lo miro. Brilla bajo el sol, su hermano grande y eterno, y agrada, subyuga, magnetiza.  Es una bendición o una maldición de las deidades? Quién soy yo para juzgar tales cosas?    A veces recuerdo mi existencia de fámulo en la villa de los señores. Sin duda era una existencia  más fácil. Fui yo quien insitió en abandonarla. Aunque, quién comprende los ardides  inescrutables del albur? No yo, el que va a morir, Publio Rufo, esclavo manumiso.        ***                                                                                                        1   ",las mdulas
98,"EL MAR Y EL FARU    Cómo te conozco desde el inicio, Faro de San Juan, enemigo de mi gula de hombres y sed de  cambios durante la monotonía de mi existencia. Pues, aun variado en mi vientre, la existencia  en la superficie me aburre, me hace dormitar y ser travieso. Qué más da al humano unas  decenas de vidas? Pero ahí estás tú, erguido y constante, como yo mismo, para evitarlo.    En la que vosotros llamáis La Punta del Castillo me he llevado yo unas cuentas piezas cobradas.  Pues desde el Cabo de Peñas no teníais otra luminaria de los escarpes y bajíos. Entonces te  construyeron, adosado a un edificio que servía para todo, desde almacén y aduana, hasta  hospital improvisado. Ya la técnica iba ganando alfiles en el gran tablero del mundo.    Tu primera luz era amarillenta como la de un cirio, perdona que te lo recuerde, pues se  alumbraba de aceite de oliva. A pesar de su aspecto fantasmal, salvó a unos cuantos  desdichados. Pronto te suministraron parafina, y ahí llegó tu soberbia, pues te sentías capaz de  hacerme frente. A mí, más extenso que los continentes todos, más poderoso que máquina  alguna inventada por la especie humana!    Y cuándo te acoplaron las pantallas giratorias y un tambor dióptrico de rojo cristal? No cabías  en ti de gozo, con tu cuerpecillo de pirámide y tu ojo de Polifemo. Ciertamente casi no se hundía  ya nadie, tras cualquier incidente los hombres eran rescatados. Sí!    Ahora ya eres eléctrico. Tu luz se expande más de veinte millas náuticas. Has ido avanzando,  pensarás, y yo me mantengo con las fuerzas iniciales, con idénticas armas que cuando me  surcaban los trirremes o los navíos vikingos. Pero no te fíes!    Eres un orgulloso! Te viene de fabricación. Quién hubiese podido prever que con los cañones  de corsarios ingleses iban a edificarte.    No olvides esto: tú mejorarás, y amanecerá un día en que ningún pescador o marino fallezca en  estas aguas. Pero yo soy eterno y perseverante. En esta partida de ajedrez infinita, nunca me  doy por vencido. No pongas esa cara de suficiencia! La odio!    ***                                                                                                         1   ",el mar y el faru
