ID,Textos,Título
60,"RAMIRO        Era un día doloroso para el barrio. La antigua fábrica de cervezas, un símbolo de la  ciudad, iba a ser demolida junto con su maquinaria obsoleta, pero de indudable valor  histórico: viejos silos, tolvas, tanques de fermentación y embotelladoras. Nunca más  volvería el olor a cebada. Trasladada a un polígono industrial de tecnología puntera,  el terreno fue adquirido para albergar un comercio de teléfonos móviles.    Artefactos de derribo estaban preparados para dar los primeros mordiscos a las  paredes. El mecanismo de un martillo rompedor hidráulico se puso en marcha    Mientras todo se precipitaba sin remedio, una familia echó de menos a un anciano.  Quizá se había marchado lejos, para evitar ser testigo de esos momentos.    Cuando el artefacto pesado se disponía a comenzar su embestida, de una ventana  surgió una silueta. Altavoz en mano, juró que no derribarían el edificio al que dedicó  una vida de trabajo. Si entraban a detenerlo, se arrojaría al vacío.    El lugar se llenó de curiosos y cámaras de televisión. Ni los más avezados  negociadores de la policía eran capaces de disuadir al okupa de la tercera edad.  Algunos le tachaban de enfermo; otros, la mayoría, de héroe del pueblo. Un par de  días después el nombre de Ramiro y su rostro adornaron camisetas y tazas de  desayuno.    Tras una semana, ante el impacto mediático negativo, la empresa de telefonía se  comprometió a restaurar la fachada principal y a mantener un patio interior cubierto  con la maquinaria. También firmaron un convenio con el ayuntamiento y la cervecera  para organizar exposiciones.    Solo entonces el hombre cedió. Tras tantas emociones, su corazón se rompía en  pequeñas esquirlas. Se fue con una sonrisa.    Como catedrática de ingeniería industrial organizo actividades para mis alumnos en  el edificio, respetuoso con su pasado. Igual que un faro, la antigua chimenea sobresale  sobre los tejados, siempre orgullosa, como yo, de mi abuelo Ramiro.    AUTOR: ÁNGEL SAIZ MORA   ",ramiro
61," LA CIUDAD Y LAS SOMBRAS   Francisco! Pero dónde se ha metido usted?  Aquí estoy, señor Palacios, limpiando  la conmutatriz, que con los bombardeos no he podido ir a casa. Ya me ve hecho un  mendigo!  . Qué importa eso, hombre de Dios?  responde Antonio Palacios, el  arquitecto del edificio que alberga el generador del Metro de Madrid . Es que no sabe  que la ciudad se ha quedado sin luz? Excepto los hospitales, que usan sus propios  generadores, está todo a oscuras. La gente permanece inmóvil . Se han acostumbrado a  tantas penalidades que ni lo notarán  La pobre gente, que busca a tientas los refugios,  está aterrada! Tampoco hay bombillas en las entradas del Metropolitano, y han caído a  las vías unas señoras. He telefoneado a don Miguel Otamendi; el ministro está enfermo,  aunque me ha dado carta blanca. Así que la resolución la tomaremos aquí, los tres. Usted  en nombre de la Unión. Necesitamos un ingeniero en estos trances  . Yo podría desviar  parte de la energía Quiero que lo juzgue quien ha construido el generador. Con una  linterna intenta don Antonio pasar los minutos. Estudia las vigas de su propio hijuelo,  pues fue él quien diseñó la cerámica, la alternancia de ladrillo y metal, la nave de motores.    Llega Otamendi, sudando.  Buenas tardes. En Madrid no hay ni noche ni día. Polvo,  proyectiles y tinieblas  Don Miguel, don Antonio dice que hay que resolver ya. Pero no  sé, tras los estragos, cómo funcionará un arranque en negro  . Si existe otra solución, le  escucho   Yo soy solo un perito y don Antonio . Miguel, qué puede suceder a esta  pobre capital. Necesitamos también el Metro . Lo peor, amigo mío, es que no sea  posible. El obús que cayó el otro día ha afectado a los imanes. Y que nos despertemos sin  Metro y sin iluminación  Sería horroroso! Y no solo a efectos prácticos, sino para la  moral  . No resta más que un camino, señores. A por ello!    El modo de arranque es delicado. Mientras no se alcance la velocidad síncrona en los  bornes de las escobillas, aparece una corriente alterna no deseada. Va? Va! Sí! Una  pequeña victoria entre tanto desastre!    Respiran, aliviados. Saca el perito una botella que guarda para las ocasiones gozosas, que  son cada vez menos.    Sobre Madrid, con hambre y miedo, se tiende la guirnalda dulcísima de miles de  filamentos encendidos. Hay luz nuevamente!   ",la ciudad y las sombras
62,"ATARDECE EN NUEVO BAZTÁN    1725     Señor de Goyeneche, siento traeros malas noticias. El señor de Churriguera ha muerto    Vaya, en este momento pensaba en él y en nuestras fantasías! Ojalá la tierra le sea leve al gran  amigo. Yo cumplo ya sesenta y ocho y a no tardar me reuniré con él. Escucháis, Agosti?    Cada sílaba, usía  Quiero que me sepulten aquí, en Nuevo Baztán, en la iglesia que él levantó  ante mis ojos, y que se consagró a San Francisco Javier, patrón de mi Navarra  . Señor, no os  dejéis llevar por la melancolía, responde el ayudante  Al contrario. He observado el surgir,  aunque también flaquear mis proyectos. En conjunto doy gracias a Dios por una vida  aprovechada. Tú eres muy joven y no fuiste testigo lo que aquí se creó.    Va atardeciendo y las sombras de las vacías edificaciones se tornan moradas y cobrizas.    Esto se llamaba villa de Olmeda y me empeñé, por seguir a Colbert e iniciar un asentamiento a  mis expensas, en construir factorías e industrializar en algo el reino de las Españas Lo sé,  señor, porque mi abuelo se trasladó aquí . Fue un buen operario. Yo creo en muchos  trabajadores de calidad para ensamblar mundos, en vez de perezosos y arrogantes inútiles   Estuvo en la factoría de vidrio. Me hablaba de su oficial, que era uno de Flandes. Del horno y  sus 1500 grados, que si hay más o menos se destruye el vaciado  . Muchos matrimonios se  han forjado aquí. Anhelaba yo que naciesen cientos de hijos y se repoblase la zona. Vamos a  caminar por las plazas, me horroriza meditar en el lecho  Conmigo podéis desahogaros  . A  pesar de la bancarrota, ojalá se recuerde este lugar. De aquí salieron trajes de soldado y espejo  de damas y jabón palaciego. Tantos objetos útiles o suntuarios! Pero también busqué lo  grandioso, no me bastaba lo chico y llamé al mismo Churriguera.    Van por la plaza de Fiestas, de los Secretos, de la Iglesia, del Pozo, hasta llegar a la Fonda.     Si hubieses visto los bosques de acebos. Aunque se acabaron, como todo, como la misma  vida. Y otros fabricantes abarataban la mercancía hasta que mis arcas no pudieron más.  Almacené en Madrid los productos y esto se vació  Señor, hicisteis mucho por muchos. Yo  estudié en esa escuela de ahí. Cuántas vidas habéis transformado!    Y el último resplandor del día se desangraba tras las cornisas barrocas.                                                                                                            1   ",atardece en nuevo baztn
63,"                            EL SILENCIO DE LA BRUA  Fue fácil encontrar trabajo, en los años setenta las industrias conserveras en la ría  de Arousa estaban en auge. Moncha, recién separada y con una hija de corta edad,  se enfrenta a su nueva vida, después de abandonar su hogar matrimonial en una  época en que eso estaba prohibido. Su jornada empezaba temprano ya que hacía  horas extras. Le gustaba trabajar en la zona de despiece de los enormes atunes  antes de pasar a la zona de cocedero. Las batas blancas aún después de lavadas  seguían oliendo a atún. El ruido de las máquinas se acabó haciendo familiar  después de pasar tantas horas en la fábrica. Los días de frío invierno, se le llenaban  los dedos de sabañones, protuberancias que empezaban picando y acababan  rompiendo y doliendo en sus manos. Con el paso de los años, se fue regulando un  estatuto que aprobó una jornada laboral más adecuada a los tiempos actuales,  reduciendo horas, mejorando el precio de los salarios y más derechos laborales. La  mayoría del personal eran mujeres, se creía que ellas teniendo las manos más  pequeñas eran más delicadas con el trabajo artesanal, desvicerado y empacado en  lata del pescado y del marisco. Antonio, compañero de Moncha en el galpón, la  zona de despiezado, también se encargaba de mantener en perfecto estado el  espacio verde, situado en la entrada de la fachada principal de la fábrica, las  hortensias lucían hermosas los veranos entre la hierba, debajo de las treinta y dos  ventanas que miraban al mar. Estaba orgullosa de trabajar en la conservera más  moderna de todas las que había alrededor, con los últimos medios en tecnología,  maquinaria y en mejoras laborales. A Moncha al cumplir sesenta años, las fuerzas le  empezaron a mermar, después de casi treinta años de trabajar en la empresa, su  cuerpo menudo pedía a gritos descanso. Tras una larga baja laboral se retira, sin  olvidar nunca su paso por la industria que le dio de comer a cambio de su trabajo, su  tiempo y buena parte de su salud. Ya nunca más volvería a fichar al sentir la brua,  la sirena de aviso para el inicio de la jornada. Pocos años después, la factoría fue  vendida a otra conservera y trasladado todo el personal y la maquinaria a otra  planta. Hoy ya no suena la brua, no hay batas blancas cubriendo a mujeres. Hoy,  La de Pita, la de Vilaxoán como la llamaban, está en la memoria de muchas  generaciones. Moncha vivió con tristeza el traslado de gran parte de su vida, una  vida que finalizó dieciocho años después de su último día de trabajo remunerado.   ",el silencio de la brua
64,"EL ECO DE SITGES    Una lápida en piedra amarilla, con unas letras grabadas en azul, recuerda que  en aquella casa hubo el semanario El Eco de Sitges, propiedad de la familia  Soler. La fachada blanca es la típica de una casita de pueblo con su portalón,  ahora siempre cerrado, una ventana alta con reja de lanzas de hierro y en el  primer piso un balcón de baranda y un ventanuco, con los portones echados y  los cristales sucios de lluvia pasada y polvo acumulado.      Era la Imprenta del Eco de Sitges, la tienda de cuadernos, el taller de costura,  la redacción y el despacho con librería acristalada, el espacio mágico de donde  cada viernes salía renacido aquel periódico semanal de intereses morales y  materiales, El Eco de Sitges, semanario de información local, arte, literatura y  turismo, una reliquia del ochocientos que vencía el paso de los años y  alcanzaba su centenario. Lean el Eco de Sitges, desde el 1 de marzo de 1886.      Aprendí a leer en sus cinco columnas. En su Arte y Artistas empecé a  interesarme por pintores y cuadros, obras expuestas en las paredes de las  galerías de Sitges, que años más tarde fueron mis hogares otros, mis palacios  de invierno, mis jardines de verano. Poco a poco fui entrando en el mundo de  papel impreso y conocí al genio de imprenta que colocaba las letras  componiendo palabras y frases, a veces vueltas patas arriba u otras revueltas  divertidamente, formando gazapos surrealistas.      La pequeña Minerva manual fue sustituida por una complicada y grande  maquinaria Offset, que en pocos años quedó totalmente obsoleta. Lucía  burlona la imprenta a pedal, plantada en la entrada principal como aquella arpa  dormida en el ángulo oscuro del salón de música. Al fondo de la casona el viejo  patio se transformó en un ruidoso taller de impresión y montaje de aquel  periódico semanal, hebdomadario encabezado con el grabado panorámico del  paseo marítimo con su ciudad jardín de Terramar, enmarcando la estampa de  la iglesia parroquial, la Punta, coronada por las cumbres de Garraf, el viejo  gigante enamorado de Dona d’Aigua, madre de Falconera, Vallbona y Ginesta.                                           Autor: Isidre Roset i Juan.   ",el eco de sitges
65,"ACTIVIDADES EN EL ENTORNO DEL MAR MENOR           En los últimos tiempos se ha hablado mucho acerca del Mar Menor, uno de los  mayores tesoros presentes en la región de Murcia. Esta terrible situación se debe  principalmente a la actividad humana debido a diferentes causas.           Por un lado se encuentran los vertidos de sustancias contaminantes que provienen de  los desagües de depuradoras o de escorrentías, los residuos generados por la actividad  agrícola y explotaciones ganaderas.           A esto se suma también los residuos de la anterior actividad minera que han llegado a  través de las ramblas. La Sierra Minera se extiende desde Cartagena al Cabo de Palos pasando  por la Unión. Desde hace años se está sufriendo las consecuencias de dicha actividad debido a  que las empresas no dieron cumplimiento a la normativa, produciendo de esta manera  residuos en alto contenido metálico que pesado que llega a las ramblas y después acaba en el  mar por viento, las escorrentías y el suelo. En concreto los residuos más peligrosos se han  generado recientemente con la minería moderna, pues se trata de residuos más finos, más  reactivos y generadores de procesos bioquímicos formando sales metálicas.           La incidencia de desastres naturales como las tormentas y lluvias torrenciales propias  de esta zona geográfica ha propiciado que se arrastren más fácilmente estos residuos. A esto  se le junta una deficiente red de saneamiento y la excesiva urbanización debido al gran  turismo de esta área.           Todos estos residuos provocan lo que se conoce como eutrofización, es decir, el  enriquecimiento de nutrientes del agua particularmente de nitrógeno o fósforo lo que origina  cambios muy importantes en el ecosistema produciendo a su vez la proliferación marina de  algas, la falta de oxígeno y la dificultad de que la luz solar llegue hasta el fondo, lo que  provoca que desaparezcan organismos que vivan en ese entorno. De hecho ya se vivió ese  escenario en el que se vieron montones de peces muertos a la orilla del mar y el agua en  estado de putrefacción.           No es solamente un problema ecológico, sino social y económico pues puede  conllevar riesgos para la salud de las personas y una disminución del turismo.   ",actividades en el entorno del mar menor
66,"SALVAR EL ARABÍ            El monte Arabí está declarado patrimonio cultural de la humanidad por la UNESCO.  Se trata de uno de los monumentos naturales más importantes de la región de Murcia. En este  lugar se encuentra el legado de nuestros antepasados y su modo de vida reflejado en las  pinturas rupestres situadas en los Cantos de Visera. Posee numerosos yacimientos  arqueológicos. En el cerro Arabilejo todavía se pueden ver trozos de las murallas del poblado  de bronce que hubo allí. Al pie de éste, se encuentra uno de los campos de cazoletas. Aparte  de ello se encuentran numerosos grabados en algunas rocas cuyo origen se desconoce, lo que  propicie que giren leyendas en torno al lugar y a la forma de vida del pasado.            Posee además una gran riqueza paisajística y biológica, pues se encuentra una gran  variedad de flora y fauna que conforma el ecosistema de esta zona.            Hace tres años se planteó un proyecto de macrogranja en el término de Albacete en las  inmediaciones del Monte Arabí. Desde ese momento hasta ahora se han venido aconteciendo  numerosas manifestaciones en contra de su instalación hasta formar una plataforma llamada  Salvemos el Arabí. Esto provoco que se paralizara el proyecto aunque sigue en pie vigente  aunque falta llegar a un acuerdo. Hasta el momento se están agotando todas las vías legales  para preservar nuestro patrimonio, por lo que la presión social no ha disminuido.            Esta actividad tiene un gran impacto negativo ligado a varios ámbitos como la gran  cantidad de recursos hídricos que serían necesarios para que esto fuera posible teniendo en  cuenta que nuestros acuíferos son fósiles en su mayoría y limitados en el espacio y el tiempo,  la enorme cantidad de insectos que aflorarían como la mosca común, además de la gran  cantidad de desechos y de malos olores que generaría. Por lo tanto conllevaría u impacto  medioambiental, arqueológico, social, sanitario y paisajístico            En definitiva se trata de una industria altamente contaminante que afectaría en nuestra  vida diaria. Es por ello necesario preservar el patrimonio histórico, artístico y cultural de la  zona, pues esta actividad podría truncar a la larga también la economía y nuestro modo de  vida.   ",salvar el arabi
67,"La aldea mágica         El tintineo de los bolsillos delanteros del pantalón de mi abuelo tiene magia. No son  monedas que se convertirán en chocolates en la dulcería de mi calle. Es más fascinante. Carga  tornillos y tuercas por si encuentra alguna máquina que reparar. La punta Phillips y las mordazas  de la llave inglesa parecen títeres emergiendo del bolsillo trasero: clapclap aplauden al paso  firme y lento de mi nonno que yo acompaño a saltitos de niña. Me suelta la mano cuando  llegamos al puesto de control de calidad.          Don Balduino, ya sale la bobina nueva. Le traigo la muestra?  grita Carmelo  asomándose desde la continua Uno, en medio de la nube de vapor que desprende el secado del  papel. Parece un duende en mameluco que responde a las órdenes del patrón, mi abueloPapá  Noel industrial.          Claro, hombre! vamos, controla mi nieta!  me siento importante, a mis cinco años,  como parte del plantel de su fábrica, una de sus chicas y muchachos que produce esos rollos  gigantes de papel que se convertirán en cajas de cartón corrugado de máxima calidad.          Señorita, su muestra  Carmelo me trae el trozo de papel aún tibio, exagera el gesto  haciendo una reverencia. Río, imagino que se bajó de un trineo. El silbido de la prensa suena  como chifle alertará a los renos escondidos tras la máquina Dos?         Bajo la atenta mirada de mi abuelo corto el papel con el molde, me esmero para que el  decímetro cuadrado no tenga ni sobrantes ni faltantes. Él lo pone en la balanza de precisión:          Teresita, qué te parece?          Nonno, la puntita está en la raya roja está bien!  Mi abuelo, sabiendo que aún no sé  leer ha preparado una marca en la lectura deseada. Le sonrío satisfecha.            Carmelo, aprobado! Sigan  grita y agita la mano derecha en alto indicando O.K.;  prefiere el contacto humano en vez de intercomunicador,           Pasaron más de 50 años y sigue en mí el recuerdo de Papelera Bernal. Fundada por mi  abuelo Balduino Borroni y dos socios. Suyos fueron el diseño de las máquinas, el montaje, la  puesta en marcha y el mantenimiento. Sus operarios lo reconocieron como ingeniero sin título  y hombre en quien confiar. Ese lugar fue mi patio de juegos: aldea mágica que convertía una  pasta con olor a humedad en el papel más maravilloso, crocante y almizclado que, hecho cajas,  transformé en faros, barcos, carrozas y naves espaciales. Algo así como vivir en la mítica fábrica  de juguetes del Polo Norte.   ",la aldea magica
68,"                       Mira, Maruxina, mira      M             aruxina se miraba a veces a sí misma cuando tuvo que bajar a la             mina en los primeros años del fascismo Fue la orfandad familiar             de varones, ejecutados o expatriados por los vencedores de la  guerra, la que la lanzó, apenas adolescente, al tajo, al único sitio que podía  darle a los restos femeninos del naufragio bélico una mínima y dura esperanza  de supervivencia.         Entonces, el hecho de que una mujer bajase a la mina no era siquiera  objeto de atención por la prensa del dictador Nunca hubo artículos  sensacionalistas y, mucho menos, imágenes sobre el asunto en una televisión  arcaica, casi inexistente.         Entonces sus compañeros varones, humillados y ofendidos como ella,  no habían erguido aún el legado patriarcal del acoso, la ofensa o el  paternalismo sexistas.         Entonces casi todo era solidaridad en las galerías, compañeru, dame  tira! Porque bien sabían que el enemigo estaba fuera.           Maruxina miraba a veces cómo había salido de la mina después de llorar  por muchos compañeros muertos Después de tragar mucho polvo de carbón  y mucha bilis rebelde.         Antes, eso sí, de tener que asistir a la quiebra de la vieja solidaridad, a la  interesada confusión del otrora nítido enfrentamiento entre obreros y  patronos Antes de tener que asistir a la dilapidación de puestos de trabajo a  cambio de unas prejubilaciones torticeras que eran pan para hoy y hambre  para mañana. Antes de tener que oír a un ministro democrático decir que era  mejor que a los mineros se les diese el sueldo por estar en su casa.           Maruxina mira ahora y escucha Y oye mensajes como los de esa  bienintencionada propaganda sobre seguridad laboral, con la que se pretende  llevar a los empresarios a reflexionar sobre el escaso coste de distintos  elementos de protección en el trabajo, para acaba interrogándose  comparativamente sobre el coste de la vida de un trabajador         El anuncio concluye que La vida d’un trabayador non tien preciu!  Pero Maruxina no puede evitar una sonrisa irónica al pensar en la razón por la  que la mayoría de los patronos , de ayer, de hoy y de mañana, coincidirán en el  absurdo de plantearse el precio de la vida de un trabajador: hailos asgaya!.   ",mira maruxina mira
69,"               Quién encenderá la mecha?      A           Ntón estaba aburrido La tarde otoñal, con su luz amarilla y espesa,           aumentaba su sensación de incomodidad.                  Se sentía incómodo con una madre cada día más encerrada en  las ceremonias absurdas de los cotilleos televisivos, con un padre cuya vida se  llenaba de ritos totalmente ajenos al hogar familiar y sus habitantes, con unos  amigos que se iban hundiendo paulatinamente en su propia inconsistencia, con  unas chicas que aparecían ante él entre la atracción inevitable y el imposible  entendimiento, con una escuela donde solo se le exigía la repetición anodina  de viejas historias sin vida, con una ciudad que ya apenas capaz de ofrecerle  algo distinto al ocio consumista de las grandes superficies comerciales Con  un mundo, en fin, donde quienes no se morían de hambre agonizaban de puro  tedio. Un mundo que sólo parecía divertir a los grandes manipuladores de las  masas sumisas.         Pensando en todo eso, Antón acabó en la remozada Biblioteca Pública  que frecuentara en su infancia Y un libro cayó en sus manos como una  llamada: Rebelión en Asturias.         Días mas tarde, subyugado por los hechos que Albert Camus había  convertido en pieza teatral, oía las balas de aquel Octubre, casi noventa años  atrás, silbando sobre su cabeza mientras latían sus sienes con el mismo ardor  que daba fuerzas a los protagonistas del drama, el mismo afán por hacer de  Asturias la fértil semilla de un universo nuevo y solidario.         Oía también los sones de la vieja canción, Antón encendió la mecha,  fízolo con picardía, mientras en la pantalla del televisor y en las páginas de  los periódicos sesudos filósofos y tenaces historiadores no paraban sobre el  sentido de aquel impulso: revolución, levantamiento popular, simple revuelta,  golpe de Estado?.         Pero el mundo seguía siendo un asco, ahora globalizado Su ciudad,  un buen decorado para la impostura del todo vale Su escuela, un sórdido  instrumento para el aprendizaje de la sumisión Las chicas, un interrogante  imposible Sus amigos, la quintaesencia de la vacuidad Su familia, un  espacio ritual de incomunicación alienante         Quién encendería ya la mecha de la rebelión o el vómito?   ",quien encendera la mecha
70,"El duper.      En mi juventud serví en la obra como peón, acarreando todo tipo de material. Era  más duro que ninguno, estaba cuadrado. Después, las circunstancias me llevaron al  campo segoviano, a trabajar con los labradores.      En mis 50 años de vida, he llevado y traído las vacas al prado , he ido a por leña al  monte, he traído y llevado paquetes de hierba, transportado estiércol, (caca de vaca  para más detalles), he cargado leña ( de pino para más señas ), he sacado al coche  del jefe de más de un apuro, he llevado a los niños de paseo al monte y hasta les  he enseñado a conducir cuando crecieron.      Sí, me llaman duper, es el nombre de pila en mi casa, pero, técnicamente, soy un  Dumper marca Ausa con arranque a manivela ( y a la primera ), con caja de carga  cuadrada, nada del típico y vulgar volquete de otros dumpers, que no habría servido  igual a Leonardo, mi dueño que, aún hoy, a sus 90 años sigue dándome trabajo.      Es verdad que los años se van notando y tengo algunos achaques: tiene holgura mi  volante, el freno de mano no se sostiene, el color naranja de mi caja tiene calvas de  óxido marrón y las ruedas esperan algún revetón.      Algunos dirán que ya estoy amortizado, que mi vida útil se ha superado, yo digo que  no quiero ser chatarra ni maquinaria industrial abandonada sin nombre. Quiero  seguir siendo, por muchos años, ese duper de mi dueño segoviano.   ",el duper
